comms_num,id,score,title,url,timestamp
134,7xgvat,631,Welcome to r/ethereum - the Reddit frontpage of the Web 3.0; seriously: Read this to get started! :),https://www.reddit.com/r/ethereum/comments/7xgvat/welcome_to_rethereum_the_reddit_frontpage_of_the/,2/14/2018 12:27
5,8qsx34,67,Germany's Finance Regulator Chief: Blockchain Can Turn the Entire Financial Sector 'Upside Down',https://the-blockchain-journal.com/2018/06/13/germanys-finance-regulator-chief-blockchain-can-turn-the-entire-financial-sector-upside-down/,6/13/2018 18:38
1,8qt9uf,35,Collaboration is Key – Status & AirSwap Team up!,https://blog.status.im/collaboration-is-key-bcc5461ee286,6/13/2018 19:24
13,8qqx1v,91,ETHBerlin: hacker applications open,https://twitter.com/ethberlin/status/1006814913166225408?s=21,6/13/2018 12:54
3,8qtd74,30,Smart Contract Security: Reentrancy Attacks,https://blog.bountyone.io/smart-contract-security-reentrancy-attacks/,6/13/2018 19:35
8,8qtg8g,29,What if BitTorrent had a token?,https://medium.com/@jbackus/what-if-bittorrent-had-a-token-13d62a590aa7#title?932,6/13/2018 19:46
10,8qtgh5,23,"Freelancing, gateway for someone's success.",https://www.reddit.com/r/ethereum/comments/8qtgh5/freelancing_gateway_for_someones_success/,6/13/2018 19:47
0,8qtdbx,14,Colony’s Developer Incentives: Curated Inflation Funding for Applications Built with Colony,https://blog.colony.io/colonys-developer-incentives-710ee132ee2,6/13/2018 19:36
0,8qu6r9,7,Scaling Shout Out: OmiseGO – ConsenSys Media,https://media.consensys.net/scaling-shout-out-omisego-c5073330412b,6/13/2018 21:16
1,8qs79r,18,Professor Grigore Rosu: The K framework - a framework to formally define all programming languages,https://www.youtube.com/watch?v=JFOnoqAplAY,6/13/2018 16:56
0,8qtzgp,8,Can FOAM replace GPS and Google maps with new geospatial standard for Ethereum blockchain?,https://medium.com/decentfund/can-foam-replace-gps-and-google-maps-with-new-geospatial-standard-for-ethereum-blockchain-c372a0ab0ad6,6/13/2018 20:52
4,8qtuk8,9,"Dether will start breaking barriers to Ethereum mass adoption with its launch Wednesday, June 20",https://app.dether.io/,6/13/2018 20:35
0,8qtvba,7,Company with ERC20 Token is Creating Security Tokens Representing Assets,https://www.swarm.fund/techtokens,6/13/2018 20:37
0,8qti95,8,"BANKEX launches First Blockchain-Based Public Access Clean Water System in Narok, Kenya. BANKEX has applied blockchain technology to create a decentralized platform that restores transparency and ensures the equitable use of charitable project funds.",http://bitcoinist.com/bankex-unveils-first-blockchain-based-public-access-clean-water-system-kenya/,6/13/2018 19:53
57,8qnfs4,151,Could we get a Casper FFG release estimate?,https://www.reddit.com/r/ethereum/comments/8qnfs4/could_we_get_a_casper_ffg_release_estimate/,6/13/2018 2:50
0,8qtn03,5,FOAM’s Pioneer Local Communities – Mapping the first groups of the global community growing around FOAM,https://blog.foam.space/foams-pioneer-local-communities-6a3c11f96414,6/13/2018 20:09
4,8qtysb,5,Where are the dapp users?,https://www.reddit.com/r/ethereum/comments/8qtysb/where_are_the_dapp_users/,6/13/2018 20:50
0,8qssob,6,Consensys highlighting OmiseGo Plasma scaling solution.,https://media.consensys.net/scaling-shout-out-omisego-c5073330412b,6/13/2018 18:21
44,8qjqmy,362,"Geth v1.8.11 Streamline: 28% slimmer, 23% faster",https://github.com/ethereum/go-ethereum/releases/tag/v1.8.11,6/12/2018 19:17
13,8qr36g,8,The Truth about Smart Contracts by Jimmy Song,https://medium.com/@jimmysong/the-truth-about-smart-contracts-ae825271811f,6/13/2018 13:31
22,8qjuaq,168,Women in Afghanistan Are Being Taught Coding Skills in Order to Earn Ether,https://www.bitguru.co.uk/latest-ethereum-news/,6/12/2018 19:30
23,8qln23,86,Why Ethereum is the Future of Blockchain,https://medium.com/futuresin/why-ethereum-is-the-future-of-blockchain-950a5c56f524,6/12/2018 23:03
1,8qqg14,6,Ethereum is Now Supported in a Blockchain Messenger,https://www.reddit.com/r/ethereum/comments/8qqg14/ethereum_is_now_supported_in_a_blockchain/,6/13/2018 11:09
11,8qilfv,186,Loom SDK Beta Now Open to the Public! Upcoming SDK Roadmap and Token Utility Updates,https://medium.com/loom-network/loom-sdk-beta-now-open-to-the-public-upcoming-sdk-roadmap-and-token-utility-updates-399ef4e3b831,6/12/2018 16:39
0,8qtylu,1,Opening applications for the Building DAOs video series - Aragon,https://blog.aragon.one/opening-applications-for-the-building-daos-video-series-81a17c92149f,6/13/2018 20:49
27,8qitqf,156,Almost Half of the Top 100 Cryptos are Based On Ethereum’s Network,https://usethebitcoin.com/almost-half-of-the-top-100-cryptos-are-based-on-ethereums-network/,6/12/2018 17:13
9,8qjx0q,97,Sharding Development Update #6 - Prysmatic Labs,https://medium.com/prysmatic-labs/ethereum-sharding-biweekly-development-update-6-prysmatic-labs-2747bc55636c,6/12/2018 19:38
0,8qrsjb,3,SingularDTV - The SNGX-SNGLS AirDrop is Complete!,https://medium.com/@SingularDTV/the-sngx-sngls-airdrop-is-complete-be7860522de5,6/13/2018 15:49
2,8qlei3,44,South Korea Announces Cryptocurrency Exchanges Will Be Regulated Akin To Commercial Banks,https://toshitimes.com/south-korea-announces-cryptocurrency-exchanges-will-be-regulated-akin-to-commercial-banks/,6/12/2018 22:35
1,8qliru,44,"Forget Prices, Ethereum Is Offering a Different Value in Afghanistan",https://www.coindesk.com/afghanistan-ethereum-code-to-inspire-value/,6/12/2018 22:49
0,8qn5ui,18,"DAPPCON Berlin, July 19-20 2018: check speakerlist, registrations open",https://www.dappcon.io/,6/13/2018 2:11
6,8qsm1m,1,Does anyone know of something that would be a competitor to Yell or GrubHub based on blackchain or on ethereum?,https://www.reddit.com/r/ethereum/comments/8qsm1m/does_anyone_know_of_something_that_would_be_a/,6/13/2018 17:56
1,8qqjhj,3,"RigoBlock - Medium - ""Towards the open exchange of value: transaction latency and scalability solutions""",https://medium.com/rigoblock/towards-the-open-exchange-of-value-transaction-latency-and-scalability-solutions-dc57654a5710,6/13/2018 11:29
18,8qj9ul,66,Counterfactual: Generalized State Channels on Ethereum,https://medium.com/statechannels/counterfactual-generalized-state-channels-on-ethereum-d38a36d25fc6,6/12/2018 18:16
1,8qnvfi,10,ICOs. #BUIDL it and they will come.,https://medium.com/@dan.ryan.emmons/icos-buidl-it-and-they-will-come-c0585b3ea076,6/13/2018 3:53
30,8ql3gc,24,Eth2Phone — Send and Receive Ether Using Just your Phone Number,https://medium.com/eth2io/eth2phone-send-and-receive-ether-using-just-your-phone-number-bc60f1122a9b,6/12/2018 21:58
3,8qmyby,10,Mysterium Network - LOGIN 2018 Festival short recap,https://steemit.com/mysteriumnetwork/@mysteriumnetwork/mysterium-network-login-2018-festival-short-recap,6/13/2018 1:44
3,8qisz9,54,MR post 'What should I ask Vitalik Buterin?' with technical answer from VB in comments,https://marginalrevolution.com/marginalrevolution/2018/06/ask-vitalik-buterin.html#comments,6/12/2018 17:10
0,8qqbvu,3,DAPP for betting/predictions(main-network),https://www.reddit.com/r/ethereum/comments/8qqbvu/dapp_for_bettingpredictionsmainnetwork/,6/13/2018 10:48
9,8qhges,109,Cryptographic javascript-functions for ethereum and tutorials on how to use them together with web3js and solidity,https://github.com/pubkey/eth-crypto/blob/master/README.md,6/12/2018 13:00
4,8qiom0,49,What do you think of customer loyalty with ERC20 tokenization? Loyela protocol charts the future using AI and Blockchain.,https://www.superbcrew.com/loyela-creates-the-future-of-loyalty-programs-through-blockchain-and-ai/,6/12/2018 16:52
4,8qqwp4,0,"Hacking Will Make Bitcoin, Ethereum And XRP Stronger",https://www.forbes.com/sites/panosmourdoukoutas/2018/06/12/hacking-will-make-bitcoin-ethereum-and-ripple-stronger/#13683535d899,6/13/2018 12:52
4,8qku8x,17,LQDEX Trading Platform Executes the First Cross-Chain Trade,https://www.reddit.com/r/ethereum/comments/8qku8x/lqdex_trading_platform_executes_the_first/,6/12/2018 21:27
0,8qk1it,20,South Korean Banks Will Roll Out a Blockchain-Based ID Verification System in July,https://the-blockchain-journal.com/2018/06/12/south-korean-banks-will-roll-out-a-blockchain-based-id-verification-system-in-july/,6/12/2018 19:52
0,8qn2vz,4,Opening the adChain Publisher Guidelines for Public Comment,https://medium.com/metax-publication/opening-the-adchain-publisher-guidelines-for-public-comment-aa0ca9c75789,6/13/2018 2:00
1,8qlhnd,7,"Flowertokens is an experimental project centered around the tokenization and verification of natural commodities, and a first attempt at creating a combined crypto-collectible physical asset.",https://flowertokens.terra0.org/,6/12/2018 22:45
1,8qscgc,0,Last Year Crypto Price Hike Was Caused By Market Manipulation,https://www.btcnn.com/study-suggests-last-year-crypto-price-hike-caused-by-market-manipulation/,6/13/2018 17:17
0,8qk1p9,13,"district0x Dev Update - June 12th, 2018",https://blog.district0x.io/district0x-dev-update-june-12th-2018-26c171940a94,6/12/2018 19:53
0,8qj6kc,15,Ask EU a Question about Blockchain in a Live AMA,https://toshitimes.com/ask-eu-a-question-about-blockchain-in-a-live-ama/,6/12/2018 18:04
10,8qq1d5,0,Founder of TRON Acquires BitTorrent,https://toshitimes.com/founder-of-tron-acquires-bittorrent/,6/13/2018 9:50
0,8qjlt4,6,A Selfish Mining Double Spending attack Simulator,https://medium.com/@yotamyachmoorgafni/a-selfish-mining-double-spending-attack-simulator-fda1af38794b,6/12/2018 19:00
8,8qim73,10,"After asking a question in r/Buttcoin, I have been challenged in understanding the disruption of Blockchain/DLT, Smart Contracts, and Digital Assets! How exactly are business operations, legal services, and economics affected by Ethereum?",https://www.reddit.com/r/ethereum/comments/8qim73/after_asking_a_question_in_rbuttcoin_i_have_been/,6/12/2018 16:42
2,8qmp47,2,Is there a sub dedicated to sites/services that accept crypto?,https://www.reddit.com/r/ethereum/comments/8qmp47/is_there_a_sub_dedicated_to_sitesservices_that/,6/13/2018 1:11
0,8qkcxq,2,Early access opens on Dether to turn your phone into a crypto ATM,https://app.dether.io/,6/12/2018 20:30
1,8qm7rt,3,Making a Killing in Virtual Real Estate,https://www.bloomberg.com/news/articles/2018-06-12/making-a-killing-in-virtual-real-estate,6/13/2018 0:13
47,8q99q3,554,Swiss City Plans Blockchain Voting Pilot Using Ethereum-Based IDs,https://www.coindesk.com/swiss-city-plans-to-vote-on-blockchain-using-ethereum-digital-id/,6/11/2018 16:49
2,8qhj8o,11,Loom trading in now live on UPbit,https://upbit.com/exchange?code=CRIX.UPBIT.KRW-LOOM,6/12/2018 13:18
7,8qj8fo,5,"""The transaction couldn't be successfully executed""",https://www.reddit.com/r/ethereum/comments/8qj8fo/the_transaction_couldnt_be_successfully_executed/,6/12/2018 18:11
0,8qmice,3,Enigma Offers Alternative to Existing Container Runtimes Like Docker,https://www.usv.com/blog/an-overview-of-the-distributed-computing-landscape,6/13/2018 0:49
1,8qlwm0,0,NKN Looks To Revolutionize $1.4T Industry Through Blockchain-Based ”New Internet”,https://toshitimes.com/nkn-looks-to-revolutionize-1-4t-industry-through-blockchain-based-new-internet/,6/12/2018 23:35
0,8qkz2k,0,Created a subreddit for Ethereum culture - post artifacts that you think reflect us,https://www.reddit.com/r/ethculture/,6/12/2018 21:43
25,8qbzpf,53,Here's a detailed step-by-step on how to get a .eth domain via the ENS,https://www.reddit.com/r/ethereum/comments/8qbzpf/heres_a_detailed_stepbystep_on_how_to_get_a_eth/,6/11/2018 23:00
5,8qkckf,2,Cryptocup - 36 hours to go! - 43ETH in the pot!,https://medium.com/@fgoldberg/cryptocup-36-hours-to-go-c98266feea67,6/12/2018 20:29
0,8qexnp,14,Dharma Community Update: 3 Month Roadmap,https://blog.dharma.io/dharma-community-update-11-june-2018-3ea9302a023c,6/12/2018 5:28
3,8qk3wg,0,Full Data Security and Anonymity with the Adamant Messenger,https://www.reddit.com/r/ethereum/comments/8qk3wg/full_data_security_and_anonymity_with_the_adamant/,6/12/2018 20:00
0,8qjd7y,1,The Hackathon Starter Kit – Colony,https://blog.colony.io/the-hackathon-starter-kit-de4392bdcbc4,6/12/2018 18:29
7,8qevtn,12,"Would it be possible to stake in a ""trustless"" smart contract while not having the private keys of the eth in the contract?",https://www.reddit.com/r/ethereum/comments/8qevtn/would_it_be_possible_to_stake_in_a_trustless/,6/12/2018 5:21
16,8qcl7w,24,Thetta DAO Framework v0.1 has been released,http://medium.com/thetta/thetta-dao-framework-v0-1-is-released-today-55db8d27af53,6/12/2018 0:10
4,8q9jrs,77,Explaining Every Field in the Ethereum Genesis Block,https://medium.com/@brandonarvanaghi/explaining-the-genesis-block-in-ethereum-92f7d6b90c2f,6/11/2018 17:32
1,8qea7b,7,Connext Network - What We Become: Updated Positioning and Vision,https://medium.com/connext/what-we-become-66605b3e22ff,6/12/2018 3:53
3,8qjvnt,0,Question: Are there any rules or regulations around creating a ETH wallet?,https://www.reddit.com/r/ethereum/comments/8qjvnt/question_are_there_any_rules_or_regulations/,6/12/2018 19:34
15,8qahdp,43,Almost $5 Million Worth of Ethereum [ETH] Stolen In Giveaway Scams,https://blockmanity.com/news/ethereum/almost-5-mn-worth-funds-stolen-eth-giveaway-scams/,6/11/2018 19:36
9,8q8i1i,87,Crypto Startup Wala Is Reaching Real Africans with Ethereum Micropayments,https://www.coindesk.com/african-startup-ethereums-scaling-issues/,6/11/2018 14:33
9,8q91dw,63,Golem Project - Introducing Graphene-ng: running arbitrary payloads in SGX enclaves by Joanna Rutkowska,https://medium.com/golem-project/introducing-graphene-ng-running-arbitrary-payloads-in-sgx-enclaves-a03f219447a5,6/11/2018 16:12
2,8qa6oq,35,"Understanding Blockchain Fundamentals, Part 3: Delegated Proof of Stake (also discusses Layer 2 scaling & Plasma)",https://medium.com/loom-network/understanding-blockchain-fundamentals-part-3-delegated-proof-of-stake-b385a6b92ef,6/11/2018 18:59
65,8q4u0t,568,Sex Workers Turning Their Eyes To Cryptocurrencies To Substitute Banks,https://www.btcnn.com/sex-workers-turning-their-eyes-to-cryptocurrencies-to-substitute-banks/,6/11/2018 3:23
1,8qdegh,10,FOAM is excited to see Spacer implementing the crypto-spatial coordinate standard in their augmented reality social network!,https://twitter.com/foamspace/status/1006251255122022401,6/12/2018 1:49
18,8q8ywp,47,Official Draft of New Crypto Regulations Is Released by the Canadian Government,https://toshitimes.com/official-draft-of-new-crypto-regulations-is-released-by-the-canadian-government/,6/11/2018 16:01
12,8qee3a,3,How accurate/good is my piece introducing ETH to crypto-newbs,https://www.reddit.com/r/ethereum/comments/8qee3a/how_accurategood_is_my_piece_introducing_eth_to/,6/12/2018 4:09
1,8qa6rt,18,"A 7,000 Year History of Trust with MIT’s Michael Casey",https://media.consensys.net/a-7-000-year-history-of-trust-with-mits-michael-casey-f3356533f7c1,6/11/2018 18:59
0,8qjlh4,0,This is why scaleable cryptocurrencies can not come fast enough: Credit service shuts down payments on all gun purchases,https://nypost.com/2018/06/11/gun-businesses-scrambling-after-credit-service-halts-payments/,6/12/2018 18:59
3,8qa57a,11,Low 4byte coverage,https://github.com/ethereum-lists/4bytes/issues/25,6/11/2018 18:54
12,8q77dh,55,Ethereum Supply Just hit 100 million! A new milestone! Wow,https://coinmarketcap.com,6/11/2018 10:00
22,8qj76x,0,Will eth remain king? Will the technology hold up against the rest?,https://www.reddit.com/r/ethereum/comments/8qj76x/will_eth_remain_king_will_the_technology_hold_up/,6/12/2018 18:06
6,8qes76,1,What do you think of our dapp interface?,https://twitter.com/dillonfromatra/status/1006336665743310848?s=21,6/12/2018 5:06
0,8qd1h6,4,"CRYPTO STRIKERS, the new ethereum world cup game with marketplaces for trading cards",https://i.redd.it/5kx2wcezrf311.jpg,6/12/2018 1:04
16,8q8enw,15,Should I Be Using Truffle?,https://www.reddit.com/r/ethereum/comments/8q8enw/should_i_be_using_truffle/,6/11/2018 14:15
15,8qh6z6,0,Make the problem in POW much harder to solve the power centralization issue,https://www.reddit.com/r/ethereum/comments/8qh6z6/make_the_problem_in_pow_much_harder_to_solve_the/,6/12/2018 12:00
0,8qco3e,3,"A 7,000 Year History of Trust with MIT’s Michael Casey",https://media.consensys.net/a-7-000-year-history-of-trust-with-mits-michael-casey-f3356533f7c1,6/12/2018 0:19
1,8q89tc,13,"Trustless coordination mechanism for smart grid energy markets, a game theoretic approach",https://blog.hivepower.tech/2018/06/11/trustless-coordination-mechanism-for-smart-grid-energy-markets-a-game-theoretic-approach/,6/11/2018 13:47
7,8qbuzz,1,"PoA - Proof-of-Authority, can someone please explain this in more detail with regards to private sidechains? What is the estimated TPS possible as there is no mining as I understand. Validation by a few masternodes but could these be further expanded to PoS validators?",https://www.reddit.com/r/ethereum/comments/8qbuzz/poa_proofofauthority_can_someone_please_explain/,6/11/2018 22:45
0,8qgy1r,0,Ethereum available on deVere Crypto,https://www.reddit.com/r/ethereum/comments/8qgy1r/ethereum_available_on_devere_crypto/,6/12/2018 11:07
4,8q3jk2,91,Plasma Debit: Arbitrary-denomination payments in Plasma Cash -- Ethereum Research,https://ethresear.ch/t/plasma-debit-arbitrary-denomination-payments-in-plasma-cash/2198,6/11/2018 0:18
0,8qcnuf,1,Ethereum Denver - June 21st - Amberdata & Eleven Buckets,https://www.reddit.com/r/ethereum/comments/8qcnuf/ethereum_denver_june_21st_amberdata_eleven_buckets/,6/12/2018 0:18
0,8qiens,0,Interesting and huge,https://i.redd.it/rbkdjgfh9k311.jpg,6/12/2018 16:07
21,8q7is7,11,How much inflation realistically do we expect to just accept? 100M+ ETH and no signs of slowing down..Why isn't there more discussion of EIP960 (120M ETH hardcap)?,https://www.reddit.com/r/ethereum/comments/8q7is7/how_much_inflation_realistically_do_we_expect_to/,6/11/2018 11:02
1,8qgb2o,0,USD 20 Million Stolen from Ethereum Clients,https://techieworld.xyz/2018/06/12/usd-20-million-stolen-from-ethereum-clients-what-should-i-do/,6/12/2018 9:05
1,8qc3ir,2,Interoperability for non fungible tokens is here! (and the Experimental Skin Marketplace too),https://blog.e11.io/nft-interoperability-is-here-and-the-experimental-skin-marketplace-too-c70de6276a87,6/11/2018 23:12
99,8pzpcv,478,94 of the top 100 tokens by market cap are built on Ethereum!,https://www.youtube.com/watch?v=0vyVZd8bQzw,6/10/2018 13:15
0,8qbfcy,0,"“The Truth about Smart Contracts” is informative, but a sales pitch.",https://medium.com/@ryanberckmans/the-truth-about-smart-contracts-is-informative-but-a-sales-pitch-c686e7f4fede,6/11/2018 21:51
